力学基礎２I,教科書,サーウェイ基礎物理学〈1〉力学 
力学基礎２I,教科書,ISBN : 978-4807908301
力学基礎２I,教科書,
力学基礎２I,教科書,サーウェイ基礎物理学〈4〉力学・電磁気学演習
力学基礎２I,教科書,ISBN : 978-4807908332
物理学演習第一g,教科書,授業で指定のもの
無機化学基礎B,教科書,理工系学生のための基礎化学　無機化学　2020年度版，植草他，化学同人
無機化学基礎EnglishClass,教科書,理工系学生のための基礎化学　無機化学　2020年度版，植草他，化学同人
有機化学基礎E,教科書,理工系学生のための基礎化学　有機化学 2020年度版，鈴木他，化学同人
生命科学基礎第一２A,教科書,スター「生物学」（東京化学同人）
健康科学概論S1(申告専用）,教科書,特になし
東工大立志プロジェクト9,教科書,東工大立志プロジェクトガイドブック
科学技術社会論・科学技術政策Ａ,教科書,とくに定めない
宗教学Ｂ,教科書,特になし。
心理学Ｂ,教科書,和田万紀（編）『心理学（第3版）』　弘文堂
科学哲学Ｃ,教科書,特になし。適宜、資料などを配布する。
教養特論：日本思想史,教科書,プリント配布
英語第一30,教科書,毎回プリントを配布する。
英語第一30,教科書,授業には、毎回辞書を持参すること。
英語第二16,教科書,Handouts
英語第二16,教科書,*コロナウイルス感染拡大による影響のため、教科書使用を中止いたしました。間違えないようにお気をつけください。
英語第五4-LS,教科書,"Coffeeshop Discussions: the foundation of ""good"" discussions. Alan Bassaer. Nan'undo."
初級日本語31QB,教科書,"『大地(だいち)　2』   (スリーエーネットワーク)     ISBN-13: 978-4883195077          \2,800　+ tax『大地(だいち)　2 文型(ぶんけい)説明(せつめい)と翻訳(ほんやく)』(」)(英語版(えいごばん)ISBN-13: 978-4883195213 / 中国語版(ちゅうごくごばん) / 韓国語版(かんこくごばん))       \2,100　+ tax"
アカデミックライティング第十四2,教科書,Ready to Write 3: From Paragraph to Essay (Third Edition)
リーダーシップアドバンス2,教科書,必要に応じて配布する
文系エッセンス４：社会学,教科書,"老川慶喜, 2016, 『もう一度読む 山川日本戦後史』山川出版社．"
情報リテラシ第一1b(IL1),教科書,なし
情報リテラシ第一1c(IL1),教科書,なし
情報リテラシ第一5a(IL1),教科書,なし
情報リテラシ第一5b(IL1),教科書,なし
グローバル企業の研究開発実践論J,教科書,市販教科書は使わず、担当教員が用意した内容を毎回講義資料として活用する。
修士キャリアデザイン演習B2,教科書,指定なし
教養特論：ミュージアムから学ぶ科学・技術・文化コミュニケーション,教科書,特になし
文系エッセンス３９：意思決定論E1,教科書,該当なし。
人間文化論Ｃ,教科書,合隼雄の二著作『ユング心理学入門』、『生と死の接点』（岩波現代文庫）。講義には必ずこの二冊を持参すること。
ALP研修Ⅲ（国内研修）B,教科書,無し
日本文化演習1:ことばと文化1QC,教科書,Not specified.
線形代数学第一・演習B（8～１3）,教科書,「数研講座シリーズ 大学教養 線形代数」加藤文元，数研出版
力学基礎１A,教科書,「力学」福島雄児・杉山忠男著　（講談社）基礎物理学シリーズ
物理学演習第一c,教科書,授業で指定のもの
生命科学基礎第一２C,教科書,スター「生物学」（東京化学同人）
東工大立志プロジェクト2,教科書,東工大立志プロジェクトガイドブック
東工大立志プロジェクト5,教科書,東工大立志プロジェクトガイドブック
東工大立志プロジェクト19,教科書,東工大立志プロジェクトガイドブック
コミュニケーション論Ａ,教科書,特に使用しない。
英語第一31,教科書,On Board for More World Adventures
英語第一31,教科書,続・DVDで学ぶ世界の文化と英語
英語第一31,教科書,Scott Berlin / 小林めぐみ 著
英語第一31,教科書,"金星堂￥2,300 ( 税込 ￥2,530 )"
英語第一31,教科書,ISBN: 978-4-7647-3991-8
英語スピーキング演習第二1,教科書,Handouts
TOEIC対策セミナー第二,教科書,『レベル別 TOEIC® L&amp;Rテスト実力養成コース：中級編』（金星堂）ISBN978-4-7647-4090-7
韓国語１a,教科書,最新チャレンジ! 韓国語（白水社）
中級日本語11QB,教科書,中級へ行こう (スリーエーネットワーク）
フランス語文化演習１,教科書,『時事フランス語2020年度版』（朝日出版社）
文系エッセンス４５：シミュレーション社会科学,教科書,なし
日本語第五A,教科書,特に指定しない。
情報リテラシ第一2b(IL1),教科書,なし
情報リテラシ第一4c(IL1),教科書,なし
情報リテラシ第二2a(IL2),教科書,なし
TOEFL対策セミナー第十三2,教科書,Longman Preparation Course for the TOEFLiBT Test. 3rd Edition. 
TOEFL対策セミナー第十三2,教科書,Deborah Phillips Pearson Education 2015. ISBN 10:0-13-324802-X
日本企業研究とコミュニケーションスキルII,教科書,特になし
英語プレゼンテーション演習第一,教科書,Materials provided
フランス語初級１F03,教科書,『場面で学ぶフランス語１[三訂版]』（三修社）
ドイツ語初級１D31,教科書,担当教員が指定するもの
リーダーシップ道場11,教科書,授業時に新書を指定する予定です．
教養特論：オンライン学習コース概論,教科書,教材詳細については、下記ウェブサイトで5月から6月まで観覧可能です。
グローバル課題への挑戦,教科書,なし
クリエイティブディスカッションA,教科書,"Joe Goodbread, Befriending Conflict: How to Make Conflict Safer, More Productive, and More Fun (2010)"
第二外国語海外研修1A1,教科書,なし
プロフェッショナルと価値創造I,教科書,なし
社会科学系ゼミ（政治と社会）導入１,教科書,塚田穂高編『徹底検証 日本の右傾化』（筑摩選書、2017年）
技術移転と知財,教科書,なし
リーダーシップ・グループワーク発展IS,教科書,なし
線形代数学第一・演習D（21～27）,教科書,梶原健「行列のヒミツがわかる！使える！線形代数講義」（日本評論社）
力学基礎２N,教科書,講義ノートを事前にpdfで配布。
無機化学基礎C,教科書,理工系学生のための基礎化学　無機化学　2020年度版，植草他，化学同人
無機化学基礎E,教科書,理工系学生のための基礎化学　無機化学　2020年度版，植草他，化学同人
ウェルネス実習B1,教科書,なし
東工大立志プロジェクト11,教科書,東工大立志プロジェクトガイドブック
東工大立志プロジェクト16,教科書,東工大立志プロジェクトガイドブック
東工大立志プロジェクト21,教科書,東工大立志プロジェクトガイドブック
東工大立志プロジェクト23,教科書,東工大立志プロジェクトガイドブック
東工大立志プロジェクト37,教科書,東工大立志プロジェクトガイドブック
教養特論：多文化共生論,教科書,なし。
言語学Ｂ,教科書,[入門]ことばの世界　瀬田，保阪，外池，中島編著，大修館書店
科学史Ｃ,教科書,特になし。
技術史Ｃ,教科書,なし
英語第一1,教科書,"Issues For Today 3, (Cengage)"
英語第一5,教科書,プリント教材
英語第一37,教科書,Handouts
英語第一37,教科書,*コロナウイルス感染拡大による影響のため、教科書使用を中止いたしました。間違えないようにお気をつけください。
英語第一39,教科書,"Mills, Robin L., and Laurie L Frazier. 2014. NorthStar: Listening &amp; Speaking, Level 2. Fourth Edition. White Plains, New York: Pearson Education. (ISBN: 978-0134049793)"
英語第五19-LS,教科書,"Ellen Kisslinger (2017) Contemporary Topics 2: 21st Century Skills for Academic Success (Fourth edition), Pearson Education "
英語第五19-LS,教科書,ISBN: 978-0-13-440080-8
中国語セミナー（応用・留学）１,教科書,話してみたい中国語スピーキング倶楽部(相原茂他、朝日出版社)
発達と学習Ⅱ,教科書,原則として、講義用のハンドアウトを用いて行う
教育実習第一Ａ,教科書,なし
中級日本語31QB,教科書,中級を学ぼう 日本語の文型と表現５６ 中級前期　第２版(スリーエーネットワーク）
中級日本語31QB,教科書,ISBN： 9784883197880
アカデミックプレゼンテーション第十三4,教科書,There is no required textbook in this course.
ゲーミング教材設計演習,教科書,・http://www.et.hum.titech.ac.jp/~matsuda/Gamingの「教授活動ゲーム用ゲーム盤作成および運用マニュアル」など
ドイツ語文化演習１,教科書,授業中に指示する。
中国語文化演習１,教科書,担当教員が指定するもの。
英語スピーチ演習第十三1,教科書,"Mark Powell, Dynamic Presentations (Cambridge University Press, 2011)"
情報リテラシ第一4a(IL1),教科書,なし
ALP研修II（海外研修）A,教科書,無し。
日本語演習71QA,教科書,なし
日本語演習51QA,教科書,テキストはこちらで用意して配布しますので、購入の必要はありません。
東工大立志プロジェクト41,教科書,東工大立志プロジェクトガイドブック
日本語・日本文化研究2,教科書,特に指定しない。
英語プレゼンテーション演習第二,教科書,Materials provided
教育課程編成の方法,教科書,・文部科学省：小学校／中学校／高等学校　学習指導要領
教育課程編成の方法,教科書,・文部科学省：小学校／中学校／高等学校　学習指導要領解説　総則編
教育課程編成の方法,教科書,"・松田稔樹, 星野敦子, 狩野浩二, 津吹卓(2012)　自ら学び考える教職教養－教育課程・制度・法規－, 学文社"
古典ギリシア語５,教科書,田中美知太郎・松平千秋『ギリシア語入門』　改訂版、岩波書店、２０１２年
古典ラテン語５,教科書,松平千秋、国原吉之助『新ラテン文法』、東洋出版、１９９７年
PLP研修1A,教科書,特になし
特別活動及び総合的な学習の時間の指導法,教科書,文部科学省：中学校／高等学校　学習指導要領解説－総合的な学習の時間編
特別活動及び総合的な学習の時間の指導法,教科書,文部科学省：中学校／高等学校　学習指導要領解説　特別活動編
スペイン語初級１S02,教科書,テジョ・マロト (1982) 『スペイン語12課』 白水社. 
スペイン語初級１S02,教科書,二宮哲 (2014) 『スペイン語文法の要点』 朝日出版社.
リーダーシップ・グループワーク基礎IIS,教科書,随時授業内で示す
リーダーシップ・グループワーク実践IS,教科書,随時授業内で示す。
リーダーシップ・グループワーク実践IIS,教科書,随時授業内で示す。
線形代数学第一・演習H(48～53),教科書,加藤文元『大学教養 線形代数』（数研出版社）
力学基礎１H,教科書,"戸田盛和『力学（物理入門コース 新装版）』岩波書店, ISBN-13: 978-4000298612"
力学基礎２O,教科書,戸田盛和「力学（物理入門コース新装版）」岩波書店
力学基礎２K,教科書,戸田盛和　力学
力学基礎２L,教科書,古典力学
力学基礎２P,教科書,古典力学
物理学演習第一e,教科書,授業で指定のもの
物理学実験第一Th,教科書,垣本史雄，江間健司編：基礎物理学実験，東京教学社
無機化学基礎D,教科書,理工系学生のための基礎化学　無機化学　2020年度版，植草他，化学同人
無機化学基礎J,教科書,理工系学生のための基礎化学　無機化学　2020年度版，植草他，化学同人
有機化学基礎I,教科書,理工系学生のための基礎化学　有機化学 2020年度版，鈴木他，化学同人
生命科学基礎第一２B,教科書,スター「生物学」（東京化学同人）
生命科学基礎第一２E,教科書,スター「生物学」（東京化学同人）
生命科学基礎第一２F,教科書,スター「生物学」（東京化学同人）
ウェルネス実習A1,教科書,必要に応じて授業内で指示する
東工大立志プロジェクト6,教科書,東工大立志プロジェクトガイドブック
東工大立志プロジェクト7,教科書,東工大立志プロジェクトガイドブック
東工大立志プロジェクト34,教科書,東工大立志プロジェクトガイドブック
東工大立志プロジェクト36,教科書,東工大立志プロジェクトガイドブック
東工大立志プロジェクト40,教科書,東工大立志プロジェクトガイドブック
文学Ｃ,教科書,教科書は指定しない。参照必要な作品に関しては適宜授業内で指示する。
英語第一3,教科書,"Level ２, Pathways: Listening, Speaking and Critical Thinking, 2nd edition, Paul Macintyre, Student Book with Online Workbook Access Code (National Geographic Learning) (ISBN-13: 978-1337562522)"
英語第一7,教科書,English for Science and Technology Students; Developing Skills for Scientific Communication
英語第一7,教科書,4技能を伸ばす理工系学生のための基礎英語（朝日出版社）
英語第一11,教科書,Online Materials
英語第一14,教科書,"Simon Horobin, The English Language: A Very Short Introduction. Oxford UP, 2018."
英語第一16,教科書,Handouts
英語第一16,教科書,*コロナウイルス感染拡大による影響のため、教科書使用を中止いたしました。間違えないようにお気をつけください。
英語第一20,教科書,"Phillips, Terry, Kenji Hitomi, and Eiichi Yubune, Integrated Technical English 『テクニカルイングリッシュ入門』 (成美堂)"
英語第一20,教科書,ISBN 978-4-7919-0075-6
英語第二14,教科書,"Simon Horobin, The English Language: A Very Short Introduction. Oxford UP, 2018."
TOEFL対策セミナー（リーディング＆ライティング）第九,教科書,教員が用意する
中国語初級１C01,教科書,『4ステップ大学生初級中国語』　陳焔・戦暁梅・劉岸偉著　白帝社　2020年3月
工業科教育法Ⅰ,教科書,高等学校学習指導要領
工業科教育法Ⅰ,教科書,授業ごとにプリントを配布する。
マルチメディアと学習環境,教科書,必要に応じて資料を配付する
教育相談論,教科書,原則として、講義用のハンドアウトを用いて行う
中級日本語22QA,教科書,中級へ行こう（スリーエーネットワーク）
TOEFL対策セミナー第十四1,教科書,Longman Preparation Course for the TOEFLiBT Test. 3rd Edition. 
TOEFL対策セミナー第十四1,教科書,Deborah Phillips Pearson Education 2015. ISBN 10:0-13-324802-X
アカデミックプレゼンテーション第十三2,教科書,excerpts from various sources
ドイツ語文化演習２,教科書,授業中に指示する。
世界を知る：中南米,教科書,特になし
心理・教育測定基礎編,教科書,松田稔樹・萩生田伸子監修(2020)　問題解決のための統計分析～データサイエンスはじめの一歩～、実教出版
心理・教育測定基礎編,教科書,（ただし、現在、発刊準備中であり、発刊するまでは配布資料を用いる予定である）
英語スピーキング演習第十四2,教科書,Handouts
言語文化演習第十三,教科書,プリント教材を配布
これからの経営管理とプロフェッショナル育成（物質理工学）,教科書,教科書は使用せず、授業中にスライド等の映像資料を使って講義を行う
情報リテラシ第一3c(IL1),教科書,なし
情報リテラシ第二4b(IL2),教科書,なし
国際研究研修３Ａ,教科書,特になし
英語第一申告専用,教科書,-
中国語初級１C05,教科書,『4ステップ大学生初級中国語』　陳焔・戦暁梅・劉岸偉著　白帝社　2020年3月
グローバルプレゼンテーションB,教科書,特定の教科書は用いない。本科目はアイディアや創造性、実践的なプレゼンテーションスキルの涵養に重きを置いている。
英語海外研修IIB1,教科書,なし
リーダーシップ入門B,教科書,指定なし．必要に応じて資料を配布する．
スペイン語１b,教科書,テジョ・マロト (1982) 『スペイン語12課』 白水社. 
スペイン語１b,教科書,二宮哲 (2014) 『スペイン語文法の要点』 朝日出版社.
社会科学系ゼミ（心理学）１,教科書,なし
融合系ゼミ（社会科学への量的アプローチ入門）１,教科書,ゼミで指示する．
アジア交流派遣学習基礎（TokyoTech-AYSEAS）,教科書,特に指定しない。
社会科学系ゼミ（政治と社会）１,教科書,塚田穂高編『徹底検証 日本の右傾化』（筑摩選書、2017年）
スペイン語初級１S03,教科書,テジョ・マロト (1982) 『スペイン語12課』 白水社. 
スペイン語初級１S03,教科書,二宮哲 (2014) 『スペイン語文法の要点』 朝日出版社.
リーダーシップ・グループワーク発展IIS,教科書,なし
線形代数学第一・演習E（28～33）,教科書,"入門線形代数, 三宅敏恒 著, 培風館"
線形代数学第一・演習F（34～40）,教科書,"入門線形代数, 三宅敏恒 著, 培風館"
力学基礎２J,教科書,特に指定しない
力学基礎２E,教科書,"力学 (物理入門コース 新装版), 戸田盛和, 岩波書店"
物理学実験第一Tu,教科書,垣本史雄，江間健司編：基礎物理学実験，東京教学社
無機化学基礎F,教科書,理工系学生のための基礎化学　無機化学　2020年度版，植草他，化学同人
有機化学基礎B,教科書,理工系学生のための基礎化学　有機化学 2020年度版，鈴木他，化学同人
有機化学基礎F,教科書,理工系学生のための基礎化学　有機化学 2020年度版，鈴木他，化学同人
有機化学基礎K,教科書,理工系学生のための基礎化学　有機化学 2020年度版，鈴木他，化学同人
東工大立志プロジェクト3,教科書,東工大立志プロジェクトガイドブック
東工大立志プロジェクト26,教科書,東工大立志プロジェクトガイドブック
東工大立志プロジェクト35,教科書,東工大立志プロジェクトガイドブック
芸術Ｃ,教科書,教科書は指定しません。授業で扱う作品の画像は、事前にOCW-iにアップします。
社会科学系ゼミ（法学ゼミ）３,教科書,学期毎に参加者と相談して決定する
英語第一6,教科書,￼On Board for More World Adventures
英語第一6,教科書, (続・DVDで学ぶ世界の文化と英語) (金星堂)
英語第一8,教科書,"CNN 10 Student News Vol. 8, Asahi Press"
英語第一15,教科書,Yuto Koizumi. 2019. Listening Lessons through 15 Inspirational Movies. Tokyo: TSURUMI SHOTEN. (ISBN: 978-4-7553-0389-0)
英語第一21,教科書,"Issues For Today 3, (Cengage)"
英語第一32,教科書,グローバル社会の潮流：ジム・カヌーセン：南雲堂
英語第一36,教科書,賛否両論の社会問題を考える２ (センゲージラーニング) (ISBN 978-4-86312-333-5)
英語第二36,教科書,賛否両論の社会問題を考える２ (センゲージラーニング) (ISBN 978-4-86312-333-5)
英語第五34-RW,教科書,Inbound/Outbound Japan
英語第五34-RW,教科書,Michael Pronko 著、金星堂
TOEFL対策セミナー（リスニング＆スピーキング）第五,教科書,"Edmunds, Paul, Nancie McKinnon, and Jeff Zeter. 2009. Developing Skills for the TOEFL iBT, Intermediate, Listening. Second edition. Compass Publishing. (ISBN: 978-59966-353-1)"
英語スピーチ演習第九,教科書,"Mark Powell, Dynamic Presentations (Cambridge University Press, 2011)"
中国語中級１,教科書,『大学生のための　中級中国語20回』（白帝社）
教育実習第三Ａ,教科書,なし
宇宙地球科学基礎ラボ（地球物質）,教科書,特になし
初級日本語31QA,教科書,"『大地(だいち)　2』   (スリーエーネットワーク)     ISBN-13: 978-4883195077          \2,800　+ tax『大地(だいち)　2 文型(ぶんけい)説明(せつめい)と翻訳(ほんやく)』(」)(英語版(えいごばん)ISBN-13: 978-4883195213 / 中国語版(ちゅうごくごばん) / 韓国語版(かんこくごばん))       \2,100　+ tax"
アカデミックプレゼンテーション第十四4,教科書,There is no required textbook in this course.
情報リテラシ第一6a(IL1),教科書,なし
情報リテラシ第二1c(IL2),教科書,なし
情報リテラシ第二3b(IL2),教科書,なし
初級日本語11QB,教科書,山崎 佳子、 土井 みつる　Basic Japanese for Students はかせ〈1〉　スリーエーネットワーク ISBN-13: 978-4883194056
社会科学系ゼミ（政策とメディアの社会学）５,教科書,適宜指示する。
融合系ゼミ（意思決定論）５,教科書,必要に応じて指定する。
融合系ゼミ（意思決定論）３,教科書,必要に応じて指定する。
TOEFL対策セミナー第十四2,教科書,Longman Preparation Course for the TOEFLiBT Test. 3rd Edition. 
TOEFL対策セミナー第十四2,教科書,Deborah Phillips Pearson Education 2015. ISBN 10:0-13-324802-X
リカレント教育発展研修4B,教科書,特になし
英語スピーキング演習第五2,教科書,Handouts
中国語初級１C08,教科書,『4ステップ大学生初級中国語』　陳焔・戦暁梅・劉岸偉著　白帝社　2020年3月
ドイツ語初級１D21,教科書,担当教員が指定するもの
古典ギリシア語１,教科書,田中美知太郎・松平千秋『ギリシア語入門』　改訂版、岩波書店、２０１２年
リーダーシップ道場12,教科書,授業時に新書を指定する予定です．
日本文化演習1:ことばと文化1QA,教科書,Not specified.
社会科学系ゼミ（日米関係と沖縄）１,教科書,適宜指示する
リーダーシップ・オフキャンパスプロジェクトA,教科書,必要に応じて設定する．
リーダーシップ・オフキャンパスプロジェクトB,教科書,必要に応じて設定する．
英語海外研修1A1,教科書,なし
リーダーシップ入門A,教科書,指定なし．必要に応じて資料を配布する．
英語第三再4,教科書,『15章版：ニュースメディアの英語2020』（朝日出版社）
スペイン語初級１S04,教科書,テジョ・マロト (1982) 『スペイン語12課』 白水社. 
スペイン語初級１S04,教科書,二宮哲 (2014) 『スペイン語文法の要点』 朝日出版社.
スペイン語初級１S07,教科書,テジョ・マロト (1982) 『スペイン語12課』 白水社. 
スペイン語初級１S07,教科書,二宮哲 (2014) 『スペイン語文法の要点』 朝日出版社.
スペイン語文化演習１,教科書,適宜配布する（授業計画を参照）
TOEFL対策セミナー（リーディング＆ライティング）第二5,教科書,"Lucas, 川端,　鈴木. 『TOEFL iBTテスト英語4技能完全対策演習』（松柏社, 2017）"
TOEFL対策セミナー（リーディング＆ライティング）第二5,教科書,"妻鳥, Stafford, 松井, 水本.『TOEFL TEST英単語スピードマスター(CD2枚付)』(Jリサーチ出版, 2006)"
線形代数学第一・演習G(41～47),教科書,『数研講座シリーズ 大学教養 線形代数』加藤文元（数研出版）
線形代数学第一・演習L(74～80),教科書,「工学のための線形代数」村山 光孝・数理工学社
力学基礎２C,教科書,戸田盛和『力学（物理入門コース新装版） 』 岩波書店
物理学演習第一h,教科書,授業で指定のもの
無機化学基礎M,教科書,理工系学生のための基礎化学　無機化学　2020年度版，植草他，化学同人
無機化学基礎O,教科書,理工系学生のための基礎化学　無機化学　2020年度版，植草他，化学同人
無機化学基礎P,教科書,理工系学生のための基礎化学　無機化学　2020年度版，植草他，化学同人
有機化学基礎D,教科書,理工系学生のための基礎化学　有機化学 2020年度版，鈴木他，化学同人
有機化学基礎EnglishClass,教科書,理工系学生のための基礎化学　有機化学 2020年度版，鈴木他，化学同人
有機化学基礎P,教科書,理工系学生のための基礎化学　有機化学 2020年度版，鈴木他，化学同人
生命科学基礎第一２G,教科書,スター「生物学」（東京化学同人）
東工大立志プロジェクト4,教科書,東工大立志プロジェクトガイドブック
東工大立志プロジェクト12,教科書,東工大立志プロジェクトガイドブック
東工大立志プロジェクト27,教科書,東工大立志プロジェクトガイドブック
